{
  "readiness_schema_version": "ao.forge.goal-run-readiness-audit.v0.1",
  "goal_run": "examples/goals/ao2-retained-evidence.goal-run.json",
  "goal_id": "ao2-weekend-hardening",
  "current_phase": "implementation",
  "requested_phase": "verification",
  "status": "passed",
  "checks": [
    {
      "check_id": "goal_validate",
      "status": "passed",
      "summary": "GoalRun schema validation passed"
    },
    {
      "check_id": "goal_inspect",
      "status": "passed",
      "summary": "next action guard is enabled"
    },
    {
      "check_id": "goal_transition",
      "status": "passed",
      "summary": "transition implementation -\u003e verification is allowed"
    },
    {
      "check_id": "evidence_lint",
      "status": "passed",
      "summary": "linted 7 evidence path(s)"
    },
    {
      "check_id": "evidence_verify",
      "status": "passed",
      "summary": "verified 7 evidence artifact(s)"
    },
    {
      "check_id": "retained_evidence",
      "status": "passed",
      "summary": "audited 7 retained evidence artifact(s)"
    }
  ],
  "evidence_lint": {
    "lint_schema_version": "ao.forge.goal-run-evidence-lint.v0.1",
    "document": "examples/goals/ao2-retained-evidence.goal-run.json",
    "document_type": "goal_run",
    "goal_id": "ao2-weekend-hardening",
    "status": "passed",
    "evidence_linted": 7,
    "evidence": [
      {
        "label": "ao2-pulse-handoff-retention-proof.json",
        "path": "docs/evidence/goals/ao2-weekend-hardening/20260619T143000Z-implementation/ao2-pulse-handoff-retention-proof.json",
        "status": "passed"
      },
      {
        "label": "ao-command-rsi-health-retention-proof.json",
        "path": "docs/evidence/goals/ao2-weekend-hardening/20260619T180000Z-verification/ao-command-rsi-health-retention-proof.json",
        "status": "passed"
      },
      {
        "label": "ao-command-rsi-manifest-retention-proof.json",
        "path": "docs/evidence/goals/ao2-weekend-hardening/20260619T180000Z-verification/ao-command-rsi-manifest-retention-proof.json",
        "status": "passed"
      },
      {
        "label": "ao-foundry-rsi-candidate-retention-proof.json",
        "path": "docs/evidence/goals/ao2-weekend-hardening/20260619T180000Z-verification/ao-foundry-rsi-candidate-retention-proof.json",
        "status": "passed"
      },
      {
        "label": "ao-foundry-rsi-improvement-gate-retention-proof.json",
        "path": "docs/evidence/goals/ao2-weekend-hardening/20260619T180000Z-verification/ao-foundry-rsi-improvement-gate-retention-proof.json",
        "status": "passed"
      },
      {
        "label": "ao-foundry-rsi-next-improvement-task-retention-proof.json",
        "path": "docs/evidence/goals/ao2-weekend-hardening/20260619T180000Z-verification/ao-foundry-rsi-next-improvement-task-retention-proof.json",
        "status": "passed"
      },
      {
        "label": "bounded-rsi-improvement-chain-retention-proof.json",
        "path": "docs/evidence/goals/ao2-weekend-hardening/20260619T180000Z-verification/bounded-rsi-improvement-chain-retention-proof.json",
        "status": "passed"
      }
    ],
    "errors": []
  },
  "evidence_verify": {
    "verify_schema_version": "ao.forge.goal-run-evidence-verify.v0.1",
    "goal_run": "examples/goals/ao2-retained-evidence.goal-run.json",
    "goal_id": "ao2-weekend-hardening",
    "status": "passed",
    "evidence_verified": 7,
    "evidence": [
      {
        "label": "ao2-pulse-handoff-retention-proof.json",
        "path": "docs/evidence/goals/ao2-weekend-hardening/20260619T143000Z-implementation/ao2-pulse-handoff-retention-proof.json",
        "expected_sha256": "dc28391a22a1ead221ee82f7d3c80d1f3766badf977722dddb147b4484e2f528",
        "actual_sha256": "dc28391a22a1ead221ee82f7d3c80d1f3766badf977722dddb147b4484e2f528",
        "status": "passed"
      },
      {
        "label": "ao-command-rsi-health-retention-proof.json",
        "path": "docs/evidence/goals/ao2-weekend-hardening/20260619T180000Z-verification/ao-command-rsi-health-retention-proof.json",
        "expected_sha256": "2b8dd4f1d01069db8e679a56aba0eaa982dd8a02e446548af9325256f7d56702",
        "actual_sha256": "2b8dd4f1d01069db8e679a56aba0eaa982dd8a02e446548af9325256f7d56702",
        "status": "passed"
      },
      {
        "label": "ao-command-rsi-manifest-retention-proof.json",
        "path": "docs/evidence/goals/ao2-weekend-hardening/20260619T180000Z-verification/ao-command-rsi-manifest-retention-proof.json",
        "expected_sha256": "e633c3925a25a40e903754de0ee441a809eba858d2c6341a95817640cf26f409",
        "actual_sha256": "e633c3925a25a40e903754de0ee441a809eba858d2c6341a95817640cf26f409",
        "status": "passed"
      },
      {
        "label": "ao-foundry-rsi-candidate-retention-proof.json",
        "path": "docs/evidence/goals/ao2-weekend-hardening/20260619T180000Z-verification/ao-foundry-rsi-candidate-retention-proof.json",
        "expected_sha256": "32946c7bfa3dbb768a0b868cd60ed07a3092306a321e98e6283673b797f6d580",
        "actual_sha256": "32946c7bfa3dbb768a0b868cd60ed07a3092306a321e98e6283673b797f6d580",
        "status": "passed"
      },
      {
        "label": "ao-foundry-rsi-improvement-gate-retention-proof.json",
        "path": "docs/evidence/goals/ao2-weekend-hardening/20260619T180000Z-verification/ao-foundry-rsi-improvement-gate-retention-proof.json",
        "expected_sha256": "11efd2f2b59307cb188ec014a533b6f80d080fa2bfc470f257dceca2f4748ea1",
        "actual_sha256": "11efd2f2b59307cb188ec014a533b6f80d080fa2bfc470f257dceca2f4748ea1",
        "status": "passed"
      },
      {
        "label": "ao-foundry-rsi-next-improvement-task-retention-proof.json",
        "path": "docs/evidence/goals/ao2-weekend-hardening/20260619T180000Z-verification/ao-foundry-rsi-next-improvement-task-retention-proof.json",
        "expected_sha256": "e6ccfd723f5af775df2d0dafa53eb824e59f3f15df8e60ee1995fdf1fa59059e",
        "actual_sha256": "e6ccfd723f5af775df2d0dafa53eb824e59f3f15df8e60ee1995fdf1fa59059e",
        "status": "passed"
      },
      {
        "label": "bounded-rsi-improvement-chain-retention-proof.json",
        "path": "docs/evidence/goals/ao2-weekend-hardening/20260619T180000Z-verification/bounded-rsi-improvement-chain-retention-proof.json",
        "expected_sha256": "82cb13938f4ce05cc43e58b2e508de2a1f6e5004c6233f72045d215ea49c53d3",
        "actual_sha256": "82cb13938f4ce05cc43e58b2e508de2a1f6e5004c6233f72045d215ea49c53d3",
        "status": "passed"
      }
    ],
    "errors": []
  },
  "provenance": {
    "goal_run": {
      "path": "examples/goals/ao2-retained-evidence.goal-run.json",
      "sha256": "3f7d345ffe6433cc212c70d99581214c7eef183d776875c7e8d22b00dfc82d33"
    },
    "evidence": [
      {
        "path": "docs/evidence/goals/ao2-weekend-hardening/20260619T143000Z-implementation/ao2-pulse-handoff-retention-proof.json",
        "sha256": "dc28391a22a1ead221ee82f7d3c80d1f3766badf977722dddb147b4484e2f528"
      },
      {
        "path": "docs/evidence/goals/ao2-weekend-hardening/20260619T180000Z-verification/ao-command-rsi-health-retention-proof.json",
        "sha256": "2b8dd4f1d01069db8e679a56aba0eaa982dd8a02e446548af9325256f7d56702"
      },
      {
        "path": "docs/evidence/goals/ao2-weekend-hardening/20260619T180000Z-verification/ao-command-rsi-manifest-retention-proof.json",
        "sha256": "e633c3925a25a40e903754de0ee441a809eba858d2c6341a95817640cf26f409"
      },
      {
        "path": "docs/evidence/goals/ao2-weekend-hardening/20260619T180000Z-verification/ao-foundry-rsi-candidate-retention-proof.json",
        "sha256": "32946c7bfa3dbb768a0b868cd60ed07a3092306a321e98e6283673b797f6d580"
      },
      {
        "path": "docs/evidence/goals/ao2-weekend-hardening/20260619T180000Z-verification/ao-foundry-rsi-improvement-gate-retention-proof.json",
        "sha256": "11efd2f2b59307cb188ec014a533b6f80d080fa2bfc470f257dceca2f4748ea1"
      },
      {
        "path": "docs/evidence/goals/ao2-weekend-hardening/20260619T180000Z-verification/ao-foundry-rsi-next-improvement-task-retention-proof.json",
        "sha256": "e6ccfd723f5af775df2d0dafa53eb824e59f3f15df8e60ee1995fdf1fa59059e"
      },
      {
        "path": "docs/evidence/goals/ao2-weekend-hardening/20260619T180000Z-verification/bounded-rsi-improvement-chain-retention-proof.json",
        "sha256": "82cb13938f4ce05cc43e58b2e508de2a1f6e5004c6233f72045d215ea49c53d3"
      }
    ]
  },
  "retention_audits": [
    {
      "retention_audit_schema_version": "ao.forge.goal-run-retained-evidence-audit.v0.1",
      "artifact": "docs/evidence/goals/ao2-weekend-hardening/20260619T143000Z-implementation/ao2-pulse-handoff-retention-proof.json",
      "goal_id": "ao2-weekend-hardening",
      "iteration": "20260619T143000Z-implementation",
      "phase": "implementation",
      "retention_class": "loop_evidence",
      "retained_at": "2026-06-19T14:30:00Z",
      "now": "2026-06-19T18:00:00Z",
      "status": "passed",
      "retention_status": "active_retention",
      "cleanup_review_status": "not_eligible_active_goal",
      "age_days": 0,
      "minimum_retention_days_after_terminal_phase": 90,
      "errors": []
    },
    {
      "retention_audit_schema_version": "ao.forge.goal-run-retained-evidence-audit.v0.1",
      "artifact": "docs/evidence/goals/ao2-weekend-hardening/20260619T180000Z-verification/ao-command-rsi-health-retention-proof.json",
      "goal_id": "ao2-weekend-hardening",
      "iteration": "20260619T180000Z-verification",
      "phase": "verification",
      "retention_class": "loop_evidence",
      "retained_at": "2026-06-19T18:00:00Z",
      "now": "2026-06-19T18:00:00Z",
      "status": "passed",
      "retention_status": "active_retention",
      "cleanup_review_status": "not_eligible_active_goal",
      "age_days": 0,
      "minimum_retention_days_after_terminal_phase": 90,
      "errors": []
    },
    {
      "retention_audit_schema_version": "ao.forge.goal-run-retained-evidence-audit.v0.1",